{
  "run_id": "p0-fixture-case-manifest",
  "case_name": "chamber-drift",
  "timestamp_utc": "2026-09-08T00:00:00+00:00",
  "git_sha": "0000000000000000000000000000000000000000",
  "app_version": "0.0.0",
  "dependency_lock_hash": "sha256:0000000000000000000000000000000000000000000000000000000000000000",
  "config_hash": "sha256:1111111111111111111111111111111111111111111111111111111111111111",
  "random_seed": null,
  "seeds_summary": {
    "n_seeds": 30,
    "seed_list_hash": "sha256:2222222222222222222222222222222222222222222222222222222222222222"
  },
  "wall_time_s": 0.0,
  "warnings": [
    "P0 hand-written fixture — proves the case-manifest schema and CI wiring only. No simulator exists yet; this is not a real case result."
  ],
  "kpis": {
    "detection_delay_median_s": null,
    "false_alarm_count_median": null
  }
}
